{
  "format": "deckle-edition",
  "version": "1.2",
  "generator": "Deckle fixture",
  "edition": {
    "paper": "Daily",
    "date": "2026-10-27",
    "number": 1,
    "place": "Test",
    "timezone": "UTC",
    "built_at": "2026-10-27T16:00:00Z",
    "cover": "cover.jpg"
  },
  "front": {
    "lead": null,
    "tiles": []
  },
  "sections": [],
  "files": []
}
